{
  "schema_version": 1,
  "id": "lint",
  "title": "Rustfmt checking and Clippy",
  "directory": "Rust/tasks/lint",
  "configuration": "Rust/tasks/lint/config/options.json",
  "operation": "lint",
  "families": [],
  "default_targets": [
    "x86_64-unknown-linux-gnu"
  ],
  "default_profile": "dev",
  "verification_status": "not-run"
}
